{
  "$schema": "http://json-schema.org/draft-07/schema#",
  "type": "object",
  "required": ["name", "template"],
  "properties": {
    "name": { "type": "string" },
    "template": { "type": "string" },
    "default": { "type": "object" },
    "props": { "type": "object" }
  },
  "additionalProperties": false
}
