{
  "name": "process-list",
  "template": "process-list/process-list.django.html",
  "default": {
    "children": "ProcessList default content"
  },
  "props": {
    "children": { "type": "string", "description": "Inner HTML or text" },
    "className": { "type": "string", "description": "Additional classes" }
  }
}
