{
  "name": "step-indicator",
  "template": "step-indicator/step-indicator.django.html",
  "default": {
    "children": "StepIndicator default content"
  },
  "props": {
    "children": { "type": "string", "description": "Inner HTML or text" },
    "className": { "type": "string", "description": "Additional classes" }
  }
}
