{
  "name": "identifier",
  "template": "identifier/identifier.django.html",
  "default": {
    "children": "NOT IMPLEMENTED: Identifier"
  },
  "props": {
    "children": { "type": "string", "description": "Inner HTML or text" },
    "className": { "type": "string", "description": "Additional classes" }
  }
}
