{
  "name": "collection",
  "template": "collection/collection.django.html",
  "default": {
    "children": "Collection default content"
  },
  "props": {
    "children": { "type": "string", "description": "Inner HTML or text" },
    "className": { "type": "string", "description": "Additional classes" }
  }
}
