{
  "name": "combobox",
  "template": "combobox/combobox.django.html",
  "default": {
    "children": "Combobox default content"
  },
  "props": {
    "children": { "type": "string", "description": "Inner HTML or text" },
    "className": { "type": "string", "description": "Additional classes" }
  }
}
