{
  "name": "pagination",
  "template": "pagination/pagination.django.html",
  "default": {
    "children": "Pagination default content"
  },
  "props": {
    "children": { "type": "string", "description": "Inner HTML or text" },
    "className": { "type": "string", "description": "Additional classes" }
  }
}
