{
  "name": "in-page-nav",
  "template": "in-page-nav/in-page-nav.django.html",
  "default": {
    "children": "NOT IMPLEMENTED: InPageNav"
  },
  "props": {
    "children": { "type": "string", "description": "Inner HTML or text" },
    "className": { "type": "string", "description": "Additional classes" }
  }
}
