{
  "name": "env-banner",
  "template": "env-banner/env-banner.django.html",
  "default": {
    "children": "NOT IMPLEMENTED: EnvBanner"
  },
  "props": {
    "children": { "type": "string", "description": "Inner HTML or text" },
    "className": { "type": "string", "description": "Additional classes" }
  }
}
